{
  "$schema": "api/schema/compatibility-manifest.schema.json",
  "schema_version": "1.0.0",
  "product_name": "Sheaft",
  "downstream_consumer_of": "Bering",
  "strict_contract_validation": true,
  "supported_upstream_artifact_types": [
    "model",
    "snapshot"
  ],
  "supported_upstream_schema_names": [
    "io.mb3r.bering.model",
    "io.mb3r.bering.snapshot"
  ],
  "supported_upstream_schema_versions": [
    "1.3.0"
  ],
  "supported_contracts": [
    {
      "artifact_type": "model",
      "schema_name": "io.mb3r.bering.model",
      "schema_version": "1.3.0",
      "schema_uri": "https://mb3r-lab.github.io/Bering/schema/model/v1.3.0/model.schema.json",
      "schema_digest": "sha256:2aa8a3550a25dc626ba6d2f5833569efca2f382b9e5c9c3405be93695d7d48ae"
    },
    {
      "artifact_type": "snapshot",
      "schema_name": "io.mb3r.bering.snapshot",
      "schema_version": "1.3.0",
      "schema_uri": "https://mb3r-lab.github.io/Bering/schema/snapshot/v1.3.0/snapshot.schema.json",
      "schema_digest": "sha256:cb778e5b0866d9ce5cfe7f23b8d98a339603593a0247cccd9cddaf05c7ae4bb1"
    }
  ],
  "tested_bering_app_versions": [
    "v1.3.0"
  ]
}
